[
  {
    "route_slug": "jfk-to-lhr-business-class",
    "origin_airport_slug": "jfk",
    "destination_airport_slug": "lhr",
    "origin_city_slug": "new-york",
    "destination_city_slug": "london",
    "primary_cabin": "Business Class",
    "route_type": "long-haul",
    "estimated_duration_minutes": 420,
    "route_summary": "The JFK to Heathrow business-class market is one of the strongest premium transatlantic corridors, where schedule quality, aircraft selection, and ground experience all matter.",
    "featured_image": "/assets/images/jfk-lhr-route.jpg",
    "airline_slugs": [
      "british-airways-business-class",
      "virgin-atlantic-upper-class",
      "delta-one"
    ],
    "aircraft_slugs": [
      "boeing-777-business-class",
      "airbus-a350-business-class"
    ],
    "internal_notes": null
  }
]